Field,Description,Type,Coverage,Users,Alphas
anl49_operatingmarginindicator,Operating margin indicator,MATRIX,52%,0,0
anl49_performancerank,A measure of a company's relative price performance over the next 12 months. It is a purely quantitative measure that is based on past earnings and price performance data. Companies are ranked relative to one another using a scale from 1 (Highest) to 5 (Lowest).,MATRIX,96%,1,8
anl49_pricegrowthpersistence,"It is the measurement of the consistency of relative price growth. Using each year of the past 10 (or fewer) as a base, a count is made of the number of subsequent years in which relative price of the stock was higher than the base period. The sum of these counts is the basis for the Index. Growth Persistence Indexes range from 100 (highest) to 5 (lowest).",MATRIX,76%,2,2
anl49_pricestabilityindex,"Index from roughly 5 to 100 measuring the stability of the stock’s price over time, higher means more stable",MATRIX,87%,0,0
anl49_pricetobookvalueindicator,Price to book value indicator,MATRIX,52%,0,0
anl49_quarterfiscalyearends,Quarter number (1–4) in which the company’s fiscal year ends,MATRIX,96%,0,0
anl49_quarterly_backfill_datayear,Year associated with the quarterly data record,MATRIX,53%,0,0
anl49_quarterly_datayear,Year of the quarterly data record,MATRIX,52%,1,1
anl49_quarterly_vector_datayear,"The financial data year associated with the record (e.g., 2000, 2001)",VECTOR,52%,0,0
anl49_recentprice,"Most recent market price used by the dataset, typically as of the latest weekly update",MATRIX,96%,0,0
anl49_retainedtocommonequity,Retained earnings as a percentage of common equity,MATRIX,46%,2,2
anl49_retainedtocommonequityindicator,Retained Earnings to common equity indicator,MATRIX,52%,3,3
anl49_safetyrank,Risk rating of the stock from 1 (safest) to 5 (riskiest),MATRIX,96%,5,5
anl49_salesorrevenues,Total annual sales or revenues reported by the company,MATRIX,49%,2,2
anl49_salesorrevenuesindicator,Sales or revenues indicator,MATRIX,52%,0,0
anl49_salesorrevenuespershare,Annual sales or revenues expressed on a per-share basis,MATRIX,48%,1,1
anl49_salesorrevenuespershareindicator,Sales or revenues per share indicator,MATRIX,52%,0,0
anl49_serviceflag,"Coverage channel flag indicating which Value Line service the stock is in (1 Investment Survey, 2 Expanded Edition, 3 Value Line Database)",MATRIX,96%,3,3
anl49_sicclassification,Standard Industrial Classification code(s) assigned to the company,MATRIX,96%,5,7
anl49_standarddeviationofpricechange,"Statistical standard deviation of the stock’s price changes over a defined period, measuring volatility",MATRIX,87%,2,2
anl49_technicalrank,"Ranking of estimated stock price performance relative to the overall market in the next three to six months, based on a complex analysis of the stock's relative price performance during the prior 52 weeks. Stocks ranked 1 (Highest) and 2 (Above Average) are likely to outpace the market during the next quarter or two. Those ranked 4 (Below Average) and 5 (Lowest) are not expected to outperform most stocks. Stocks ranked 3 (Average) will probably advance or decline with the market. The Technical Rank is purely a function of relative price action and is primarily a predictor of relative short-term price movements.",MATRIX,96%,1,1
anl49_timelinessrank,"Proprietary rank of expected relative market performance over the next year, with 1 best and 5 worst",MATRIX,96%,0,0
anl49_totalassetsindicator,Total assets indicator,MATRIX,52%,2,2
anl49_totalcapitalindicator,Total capital indicator,MATRIX,52%,0,0
anl49_typeofearningspershare,"The codes used for the type of quarterly earnings per share as reported in Primary=P, Diluted=D",MATRIX,96%,1,1
anl49_valuelineindustry,Value Line industry group classification for the company,MATRIX,96%,1,2
anl49_valugaugeestimatingdifficultyrank,Companies whose earnings are easy to forecast are rated 1; Companies whose earnings are difficult to forecast are rated 5. A rank of 3 rates average. A rank of 2 is above average and a rank of 4 is below average.,MATRIX,48%,0,0
anl49_valugaugerelativeposition,"Each company is rated from 1 to about 1600. Low numbers represent easy companies to forecast, while the higher numbers represent difficult companies to forecast.",MATRIX,48%,1,1
anl49_valugaugerelativepositionchange,"Change from the prior period in the stock’s ValuGauge relative position, often expressed as a percentage",MATRIX,48%,1,1
anl49_valugaugevarianceofearningschange,"This is the statistical factor explained for field number 30, which is rank ordered in the determination of the Difficulty Ranks and Relative Positions.",MATRIX,48%,0,0
anl49_vector_1stcalendarqtrdividendspaidpershare,Dividends paid per share in the 1st calendar quarter,VECTOR,51%,3,3
anl49_vector_1stfiscalquarterearningspershare,Earnings per share for the 1st fiscal quarter,VECTOR,52%,1,1
anl49_vector_1stfiscalquartersalesorrevenues,"Sales or revenues amount for the 1st fiscal quarter, in reported currency",VECTOR,50%,0,0
anl49_vector_2ndcalendarqtrdividendspaidpershare,Dividends paid per share in the 2nd calendar quarter,VECTOR,50%,0,0
anl49_vector_2ndfiscalquarterearningspershare,Earnings per share for the 2nd fiscal quarter,VECTOR,52%,0,0
anl49_vector_2ndfiscalquartersalesorrevenues,"Sales or revenues amount for the 2nd fiscal quarter, typically an estimate in vector records",VECTOR,50%,1,1
anl49_vector_35estd35yrgrowthratebookvaluepershare,"Estimated 3–5 year growth rate of book value per share, percent",VECTOR,49%,2,2
anl49_vector_35estd35yrgrowthratecashflowpershare,"Estimated 3–5 year growth rate of cash flow per share, percent",VECTOR,44%,0,0
anl49_vector_35estd35yrgrowthratedividendspershare,"Estimated 3–5 year growth rate of dividends per share, percent",VECTOR,48%,0,0
anl49_vector_35estd35yrgrowthrateearningspershare,"Estimated 3–5 year growth rate of earnings per share, percent",VECTOR,45%,2,2
anl49_vector_35estd35yrgrowthratesalespershare,"Estimated 3–5 year growth rate of sales per share, percent",VECTOR,46%,1,1
anl49_vector_35estd35yrhighappreciationtarget,The percentage appreciation potential computed from the stock's recent price to the projected high price 3 to 5 years hence.,VECTOR,52%,0,0
anl49_vector_35estd35yrhighavgannualtotalreturn,"Estimated high-case average annual total return over 3–5 years, percent",VECTOR,52%,3,4
anl49_vector_35estd35yrlowappreciationtarget,The percentage appreciation potential computed from the stock's recent price to the projected low price 3 to 5 years hence.,VECTOR,52%,0,0
anl49_vector_35estd35yrlowavgannualtotalreturn,"Estimated low-case average annual total return over 3–5 years, percent",VECTOR,52%,2,2
anl49_vector_35projected35yearhighpricetarget,Estimated 3–5 year high price target for the stock (vector-style timestamped record),VECTOR,52%,2,2
anl49_vector_35projected35yearlowpricetarget,Estimated 3–5 year low price target for the stock (vector-style timestamped record),VECTOR,52%,1,1
anl49_vector_3rdcalendarqtrdividendspaidpershare,Dividends paid per share in the 3rd calendar quarter,VECTOR,45%,0,0
anl49_vector_3rdfiscalquarterearningspershare,Earnings per share for the 3rd fiscal quarter,VECTOR,52%,0,0
anl49_vector_3rdfiscalquartersalesorrevenues,"Sales or revenues amount for the 3rd fiscal quarter, typically an estimate in vector records",VECTOR,50%,2,2
anl49_vector_4thcalendarqtrdividendspaidpershare,Dividends paid per share in the 4th calendar quarter,VECTOR,35%,0,0
anl49_vector_4thfiscalquarterearningspershare,Earnings per share for the 4th fiscal quarter,VECTOR,52%,0,0
anl49_vector_4thfiscalquartersalesorrevenues,"Sales or revenues amount for the 4th fiscal quarter, typically an estimate in vector records",VECTOR,50%,0,0
anl49_vector_alldividendstonetprofit,Ratio of all dividends paid to net profit (percent/ratio),VECTOR,30%,0,0
anl49_vector_annualfiscalearningspershare,"Earnings per share for the fiscal year (annual), typically an estimate in vector records",VECTOR,52%,0,0
anl49_vector_annualfiscalsalesorrevenues,"Total sales or revenues for the fiscal year (annual), typically an estimate in vector records",VECTOR,50%,0,0
anl49_vector_averageannualdividendyield,"Average annual dividend yield over recent years, percent",VECTOR,50%,7,10
anl49_vector_averageannualperatio,Average of annual P/E ratios over recent years (vector-style record),VECTOR,50%,0,0
anl49_vector_averageannualrelativepe,Average of annual relative P/E ratios (vs market) over recent years,VECTOR,50%,0,0
anl49_vector_bookvaluepershare,"Book value per common share at fiscal year-end (assets minus liabilities and prior claims, divided by shares)",VECTOR,52%,2,2
anl49_vector_calendaryeardividendspaidpershare,Total dividends paid per share over the entire calendar year,VECTOR,35%,0,0
anl49_vector_capitalspendingpershare,"Capital expenditures per common share for the fiscal year, in currency per share",VECTOR,44%,0,0
anl49_vector_cashflowpershare,"Cash flow per share (annual), typically cash flow available to common shareholders; defined by Value Line as cash flow less preferred dividends",VECTOR,47%,0,0
anl49_vector_commonsharesoutstanding,Total number of common shares outstanding,VECTOR,52%,0,0
anl49_vector_depreciationdepletionamortization,"Total depreciation, depletion, and amortization expense for the fiscal year (reported currency)",VECTOR,41%,0,0
anl49_vector_dividendsdeclaredpershare,Dividends declared per share for the fiscal year (currency per share),VECTOR,52%,0,0
anl49_vector_earnednetworth,"Amount of net worth earned during the year, total in reported currency",VECTOR,48%,8,10
anl49_vector_earnedtotalcapital,Total earned capital of the company (reported currency),VECTOR,46%,2,8
anl49_vector_earningspershare,"Earnings per share (EPS) for the fiscal year, in currency per share",VECTOR,52%,0,0
anl49_vector_incometaxrate,Effective income tax rate for the year (percentage of earnings),VECTOR,48%,0,0
anl49_vector_longtermdebt,"Total long-term debt at fiscal year-end, in reported currency",VECTOR,40%,2,2
anl49_vector_netprofit,"Company’s net income for the fiscal year (total, reported currency)",VECTOR,52%,0,0
anl49_vector_netprofitmargin,Net profit as a percentage of sales/revenues for the fiscal year (net profit margin),VECTOR,44%,1,1
anl49_vector_networth,"Shareholders’ equity (net worth) at year-end, in reported currency",VECTOR,49%,3,3
anl49_vector_operatingmargin,Operating margin for the year (percentage of revenues),VECTOR,45%,0,0
anl49_vector_retainedtocommonequity,Ratio of retained earnings to common equity (retained to common equity),VECTOR,46%,0,0
anl49_vector_salesorrevenues,Total annual sales or revenues reported for the fiscal year (company currency),VECTOR,49%,0,0
anl49_vector_salesorrevenuespershare,"Sales or revenues per share (annual), in currency per share",VECTOR,48%,3,3
anl49_vector_workingcapital,"Working capital (current assets minus current liabilities), in reported currency",VECTOR,44%,0,0
anl49_workingcapital,Working capital at fiscal year end (current assets minus current liabilities),MATRIX,44%,1,1
anl49_workingcapitalindicator,Working capital indicator,MATRIX,52%,0,0
